{"candidateId":"null","configId":"config-1","sourceId":"item-1","blindLabel":"A","attempt":1,"status":"passed","failure":{"code":"none","message":"fixture","stage":"score","recoverable":false},"transcript":"hello","audioPath":null,"normalizationVersion":"v1","revisionTrace":[{"sequence":1,"monotonicMs":10,"text":"hel","replacedCharacters":0},{"sequence":2,"monotonicMs":20,"text":"hello","replacedCharacters":1}],"metrics":{"speechStartToFirstPartialMs":120,"endpointToFinalMs":180,"ttsTimeToFirstAudioMs":null,"rtf":0.2,"wer":0,"cer":0,"partialRevisionCount":1,"partialChurnCharacters":1,"underruns":0,"droppedFrames":0,"peakVramBytes":1000,"steadyVramBytes":800}}
